{
  "archetype_id": "energy_4p_03",
  "category": "energy_4plus",
  "cluster_id": 3,
  "cluster_share": 0.139,
  "description": "Medium-cost structure featuring alternating high and low periods, creating pronounced temporal contrasts; intra-period uniformity coupled with inter-period variation suggests targeted TOU differentiation.",
  "representative_plan": {
    "name": "Southern California Edison Co, Time-Of-Use - General Service - Large: TOU-8, Option R (At 220kV)",
    "state": "CA",
    "eia_id": 17609
  },
  "periods": [
    {
      "period_index": 1,
      "label": "period-1",
      "tiers": [
        {
          "rate": 0.08211,
          "max": null,
          "adj": -0.0131
        }
      ]
    },
    {
      "period_index": 2,
      "label": "period-2",
      "tiers": [
        {
          "rate": 0.12385,
          "max": null,
          "adj": -0.0131
        }
      ]
    },
    {
      "period_index": 3,
      "label": "period-3",
      "tiers": [
        {
          "rate": 0.099,
          "max": null,
          "adj": -0.0131
        }
      ]
    },
    {
      "period_index": 4,
      "label": "period-4",
      "tiers": [
        {
          "rate": 0.15943,
          "max": null,
          "adj": -0.0131
        }
      ]
    },
    {
      "period_index": 5,
      "label": "period-5",
      "tiers": [
        {
          "rate": 0.32733,
          "max": null,
          "adj": -0.0131
        }
      ]
    }
  ],
  "unit": "$/kWh",
  "key_states": {
    "by_count": [
      "CA",
      "AZ",
      "NV"
    ],
    "by_share": [
      "CT",
      "IN",
      "UT"
    ]
  },
  "period_map": {
    "weekday": [
      [
        1,
        1,
        1,
        1,
        1,
        1,
        1,
        1,
        2,
        2,
        2,
        2,
        2,
        2,
        2,
        2,
        2,
        2,
        2,
        2,
        2,
        1,
        1,
        1
      ],
      [
        1,
        1,
        1,
        1,
        1,
        1,
        1,
        1,
        2,
        2,
        2,
        2,
        2,
        2,
        2,
        2,
        2,
        2,
        2,
        2,
        2,
        1,
        1,
        1
      ],
      [
        1,
        1,
        1,
        1,
        1,
        1,
        1,
        1,
        2,
        2,
        2,
        2,
        2,
        2,
        2,
        2,
        2,
        2,
        2,
        2,
        2,
        1,
        1,
        1
      ],
      [
        1,
        1,
        1,
        1,
        1,
        1,
        1,
        1,
        2,
        2,
        2,
        2,
        2,
        2,
        2,
        2,
        2,
        2,
        2,
        2,
        2,
        1,
        1,
        1
      ],
      [
        1,
        1,
        1,
        1,
        1,
        1,
        1,
        1,
        2,
        2,
        2,
        2,
        2,
        2,
        2,
        2,
        2,
        2,
        2,
        2,
        2,
        1,
        1,
        1
      ],
      [
        3,
        3,
        3,
        3,
        3,
        3,
        3,
        3,
        4,
        4,
        4,
        4,
        5,
        5,
        5,
        5,
        5,
        5,
        4,
        4,
        4,
        4,
        4,
        3
      ],
      [
        3,
        3,
        3,
        3,
        3,
        3,
        3,
        3,
        4,
        4,
        4,
        4,
        5,
        5,
        5,
        5,
        5,
        5,
        4,
        4,
        4,
        4,
        4,
        3
      ],
      [
        3,
        3,
        3,
        3,
        3,
        3,
        3,
        3,
        4,
        4,
        4,
        4,
        5,
        5,
        5,
        5,
        5,
        5,
        4,
        4,
        4,
        4,
        4,
        3
      ],
      [
        3,
        3,
        3,
        3,
        3,
        3,
        3,
        3,
        4,
        4,
        4,
        4,
        5,
        5,
        5,
        5,
        5,
        5,
        4,
        4,
        4,
        4,
        4,
        3
      ],
      [
        1,
        1,
        1,
        1,
        1,
        1,
        1,
        1,
        2,
        2,
        2,
        2,
        2,
        2,
        2,
        2,
        2,
        2,
        2,
        2,
        2,
        1,
        1,
        1
      ],
      [
        1,
        1,
        1,
        1,
        1,
        1,
        1,
        1,
        2,
        2,
        2,
        2,
        2,
        2,
        2,
        2,
        2,
        2,
        2,
        2,
        2,
        1,
        1,
        1
      ],
      [
        1,
        1,
        1,
        1,
        1,
        1,
        1,
        1,
        2,
        2,
        2,
        2,
        2,
        2,
        2,
        2,
        2,
        2,
        2,
        2,
        2,
        1,
        1,
        1
      ]
    ],
    "weekend": [
      [
        1,
        1,
        1,
        1,
        1,
        1,
        1,
        1,
        1,
        1,
        1,
        1,
        1,
        1,
        1,
        1,
        1,
        1,
        1,
        1,
        1,
        1,
        1,
        1
      ],
      [
        1,
        1,
        1,
        1,
        1,
        1,
        1,
        1,
        1,
        1,
        1,
        1,
        1,
        1,
        1,
        1,
        1,
        1,
        1,
        1,
        1,
        1,
        1,
        1
      ],
      [
        1,
        1,
        1,
        1,
        1,
        1,
        1,
        1,
        1,
        1,
        1,
        1,
        1,
        1,
        1,
        1,
        1,
        1,
        1,
        1,
        1,
        1,
        1,
        1
      ],
      [
        1,
        1,
        1,
        1,
        1,
        1,
        1,
        1,
        1,
        1,
        1,
        1,
        1,
        1,
        1,
        1,
        1,
        1,
        1,
        1,
        1,
        1,
        1,
        1
      ],
      [
        1,
        1,
        1,
        1,
        1,
        1,
        1,
        1,
        1,
        1,
        1,
        1,
        1,
        1,
        1,
        1,
        1,
        1,
        1,
        1,
        1,
        1,
        1,
        1
      ],
      [
        3,
        3,
        3,
        3,
        3,
        3,
        3,
        3,
        3,
        3,
        3,
        3,
        3,
        3,
        3,
        3,
        3,
        3,
        3,
        3,
        3,
        3,
        3,
        3
      ],
      [
        3,
        3,
        3,
        3,
        3,
        3,
        3,
        3,
        3,
        3,
        3,
        3,
        3,
        3,
        3,
        3,
        3,
        3,
        3,
        3,
        3,
        3,
        3,
        3
      ],
      [
        3,
        3,
        3,
        3,
        3,
        3,
        3,
        3,
        3,
        3,
        3,
        3,
        3,
        3,
        3,
        3,
        3,
        3,
        3,
        3,
        3,
        3,
        3,
        3
      ],
      [
        3,
        3,
        3,
        3,
        3,
        3,
        3,
        3,
        3,
        3,
        3,
        3,
        3,
        3,
        3,
        3,
        3,
        3,
        3,
        3,
        3,
        3,
        3,
        3
      ],
      [
        1,
        1,
        1,
        1,
        1,
        1,
        1,
        1,
        1,
        1,
        1,
        1,
        1,
        1,
        1,
        1,
        1,
        1,
        1,
        1,
        1,
        1,
        1,
        1
      ],
      [
        1,
        1,
        1,
        1,
        1,
        1,
        1,
        1,
        1,
        1,
        1,
        1,
        1,
        1,
        1,
        1,
        1,
        1,
        1,
        1,
        1,
        1,
        1,
        1
      ],
      [
        1,
        1,
        1,
        1,
        1,
        1,
        1,
        1,
        1,
        1,
        1,
        1,
        1,
        1,
        1,
        1,
        1,
        1,
        1,
        1,
        1,
        1,
        1,
        1
      ]
    ]
  }
}