{
  "archetype_id": "energy_3p_03",
  "category": "energy_3period",
  "cluster_id": 3,
  "cluster_share": 0.099,
  "description": "Moderate-to-high cost TOU schedule with strong inter-period contrast and a pronounced on-peak premium; representative of southwestern IOU pricing frameworks.",
  "representative_plan": {
    "name": "El Paso Electric Co, Small General Service Rate TOU",
    "state": "NM",
    "eia_id": 5701
  },
  "periods": [
    {
      "period_index": 1,
      "label": "mid-peak",
      "tiers": [
        {
          "rate": 0.10168,
          "max": null,
          "adj": 0.02621
        }
      ]
    },
    {
      "period_index": 2,
      "label": "on-peak",
      "tiers": [
        {
          "rate": 0.22271,
          "max": null,
          "adj": 0.02685
        }
      ]
    },
    {
      "period_index": 3,
      "label": "off-peak",
      "tiers": [
        {
          "rate": 0.07107,
          "max": null,
          "adj": 0.02605
        }
      ]
    }
  ],
  "unit": "$/kWh",
  "key_states": {
    "by_count": [
      "IN",
      "TX",
      "WI"
    ],
    "by_share": [
      "PA",
      "IL",
      "NM"
    ]
  },
  "period_map": {
    "weekday": [
      [
        1,
        1,
        1,
        1,
        1,
        1,
        1,
        1,
        1,
        1,
        1,
        1,
        1,
        1,
        1,
        1,
        1,
        1,
        1,
        1,
        1,
        1,
        1,
        1
      ],
      [
        1,
        1,
        1,
        1,
        1,
        1,
        1,
        1,
        1,
        1,
        1,
        1,
        1,
        1,
        1,
        1,
        1,
        1,
        1,
        1,
        1,
        1,
        1,
        1
      ],
      [
        1,
        1,
        1,
        1,
        1,
        1,
        1,
        1,
        1,
        1,
        1,
        1,
        1,
        1,
        1,
        1,
        1,
        1,
        1,
        1,
        1,
        1,
        1,
        1
      ],
      [
        1,
        1,
        1,
        1,
        1,
        1,
        1,
        1,
        1,
        1,
        1,
        1,
        1,
        1,
        1,
        1,
        1,
        1,
        1,
        1,
        1,
        1,
        1,
        1
      ],
      [
        1,
        1,
        1,
        1,
        1,
        1,
        1,
        1,
        1,
        1,
        1,
        1,
        1,
        1,
        1,
        1,
        1,
        1,
        1,
        1,
        1,
        1,
        1,
        1
      ],
      [
        3,
        3,
        3,
        3,
        3,
        3,
        3,
        3,
        3,
        3,
        3,
        3,
        2,
        2,
        2,
        2,
        2,
        2,
        3,
        3,
        3,
        3,
        3,
        3
      ],
      [
        3,
        3,
        3,
        3,
        3,
        3,
        3,
        3,
        3,
        3,
        3,
        3,
        2,
        2,
        2,
        2,
        2,
        2,
        3,
        3,
        3,
        3,
        3,
        3
      ],
      [
        3,
        3,
        3,
        3,
        3,
        3,
        3,
        3,
        3,
        3,
        3,
        3,
        2,
        2,
        2,
        2,
        2,
        2,
        3,
        3,
        3,
        3,
        3,
        3
      ],
      [
        3,
        3,
        3,
        3,
        3,
        3,
        3,
        3,
        3,
        3,
        3,
        3,
        2,
        2,
        2,
        2,
        2,
        2,
        3,
        3,
        3,
        3,
        3,
        3
      ],
      [
        1,
        1,
        1,
        1,
        1,
        1,
        1,
        1,
        1,
        1,
        1,
        1,
        1,
        1,
        1,
        1,
        1,
        1,
        1,
        1,
        1,
        1,
        1,
        1
      ],
      [
        1,
        1,
        1,
        1,
        1,
        1,
        1,
        1,
        1,
        1,
        1,
        1,
        1,
        1,
        1,
        1,
        1,
        1,
        1,
        1,
        1,
        1,
        1,
        1
      ],
      [
        1,
        1,
        1,
        1,
        1,
        1,
        1,
        1,
        1,
        1,
        1,
        1,
        1,
        1,
        1,
        1,
        1,
        1,
        1,
        1,
        1,
        1,
        1,
        1
      ]
    ],
    "weekend": [
      [
        1,
        1,
        1,
        1,
        1,
        1,
        1,
        1,
        1,
        1,
        1,
        1,
        1,
        1,
        1,
        1,
        1,
        1,
        1,
        1,
        1,
        1,
        1,
        1
      ],
      [
        1,
        1,
        1,
        1,
        1,
        1,
        1,
        1,
        1,
        1,
        1,
        1,
        1,
        1,
        1,
        1,
        1,
        1,
        1,
        1,
        1,
        1,
        1,
        1
      ],
      [
        1,
        1,
        1,
        1,
        1,
        1,
        1,
        1,
        1,
        1,
        1,
        1,
        1,
        1,
        1,
        1,
        1,
        1,
        1,
        1,
        1,
        1,
        1,
        1
      ],
      [
        1,
        1,
        1,
        1,
        1,
        1,
        1,
        1,
        1,
        1,
        1,
        1,
        1,
        1,
        1,
        1,
        1,
        1,
        1,
        1,
        1,
        1,
        1,
        1
      ],
      [
        1,
        1,
        1,
        1,
        1,
        1,
        1,
        1,
        1,
        1,
        1,
        1,
        1,
        1,
        1,
        1,
        1,
        1,
        1,
        1,
        1,
        1,
        1,
        1
      ],
      [
        3,
        3,
        3,
        3,
        3,
        3,
        3,
        3,
        3,
        3,
        3,
        3,
        3,
        3,
        3,
        3,
        3,
        3,
        3,
        3,
        3,
        3,
        3,
        3
      ],
      [
        3,
        3,
        3,
        3,
        3,
        3,
        3,
        3,
        3,
        3,
        3,
        3,
        3,
        3,
        3,
        3,
        3,
        3,
        3,
        3,
        3,
        3,
        3,
        3
      ],
      [
        3,
        3,
        3,
        3,
        3,
        3,
        3,
        3,
        3,
        3,
        3,
        3,
        3,
        3,
        3,
        3,
        3,
        3,
        3,
        3,
        3,
        3,
        3,
        3
      ],
      [
        3,
        3,
        3,
        3,
        3,
        3,
        3,
        3,
        3,
        3,
        3,
        3,
        3,
        3,
        3,
        3,
        3,
        3,
        3,
        3,
        3,
        3,
        3,
        3
      ],
      [
        1,
        1,
        1,
        1,
        1,
        1,
        1,
        1,
        1,
        1,
        1,
        1,
        1,
        1,
        1,
        1,
        1,
        1,
        1,
        1,
        1,
        1,
        1,
        1
      ],
      [
        1,
        1,
        1,
        1,
        1,
        1,
        1,
        1,
        1,
        1,
        1,
        1,
        1,
        1,
        1,
        1,
        1,
        1,
        1,
        1,
        1,
        1,
        1,
        1
      ],
      [
        1,
        1,
        1,
        1,
        1,
        1,
        1,
        1,
        1,
        1,
        1,
        1,
        1,
        1,
        1,
        1,
        1,
        1,
        1,
        1,
        1,
        1,
        1,
        1
      ]
    ]
  }
}