{
  "archetype_id": "energy_4p_02",
  "category": "energy_4plus",
  "cluster_id": 2,
  "cluster_share": 0.16,
  "description": "High-cost archetype characterized by strong temporal hierarchy and distinct step-up across successive periods; provides clear economic signals for peak load shifting while maintaining structural simplicity.",
  "representative_plan": {
    "name": "Southern California Edison Co, TOU General Service, Non Demand, Option C: GS-1 TOU C, Single Phase (50kV-220kV)",
    "state": "CA",
    "eia_id": 17609
  },
  "periods": [
    {
      "period_index": 1,
      "label": "period-1",
      "tiers": [
        {
          "rate": 0.1327,
          "max": null,
          "adj": 0.0
        }
      ]
    },
    {
      "period_index": 2,
      "label": "period-2",
      "tiers": [
        {
          "rate": 0.167,
          "max": null,
          "adj": 0.0
        }
      ]
    },
    {
      "period_index": 3,
      "label": "period-3",
      "tiers": [
        {
          "rate": 0.2373,
          "max": null,
          "adj": 0.0
        }
      ]
    },
    {
      "period_index": 4,
      "label": "period-4",
      "tiers": [
        {
          "rate": 0.3524,
          "max": null,
          "adj": 0.0
        }
      ]
    },
    {
      "period_index": 5,
      "label": "period-5",
      "tiers": [
        {
          "rate": 0.4913,
          "max": null,
          "adj": 0.0
        }
      ]
    }
  ],
  "unit": "$/kWh",
  "key_states": {
    "by_count": [
      "CA",
      "AZ",
      "NV"
    ],
    "by_share": [
      "NY",
      "MA",
      "AZ"
    ]
  },
  "period_map": {
    "weekday": [
      [
        1,
        1,
        1,
        1,
        1,
        1,
        1,
        1,
        2,
        2,
        2,
        2,
        2,
        2,
        2,
        2,
        2,
        2,
        2,
        2,
        2,
        1,
        1,
        1
      ],
      [
        1,
        1,
        1,
        1,
        1,
        1,
        1,
        1,
        2,
        2,
        2,
        2,
        2,
        2,
        2,
        2,
        2,
        2,
        2,
        2,
        2,
        1,
        1,
        1
      ],
      [
        1,
        1,
        1,
        1,
        1,
        1,
        1,
        1,
        2,
        2,
        2,
        2,
        2,
        2,
        2,
        2,
        2,
        2,
        2,
        2,
        2,
        1,
        1,
        1
      ],
      [
        1,
        1,
        1,
        1,
        1,
        1,
        1,
        1,
        2,
        2,
        2,
        2,
        2,
        2,
        2,
        2,
        2,
        2,
        2,
        2,
        2,
        1,
        1,
        1
      ],
      [
        1,
        1,
        1,
        1,
        1,
        1,
        1,
        1,
        2,
        2,
        2,
        2,
        2,
        2,
        2,
        2,
        2,
        2,
        2,
        2,
        2,
        1,
        1,
        1
      ],
      [
        3,
        3,
        3,
        3,
        3,
        3,
        3,
        3,
        4,
        4,
        4,
        4,
        5,
        5,
        5,
        5,
        5,
        5,
        4,
        4,
        4,
        4,
        4,
        3
      ],
      [
        3,
        3,
        3,
        3,
        3,
        3,
        3,
        3,
        4,
        4,
        4,
        4,
        5,
        5,
        5,
        5,
        5,
        5,
        4,
        4,
        4,
        4,
        4,
        3
      ],
      [
        3,
        3,
        3,
        3,
        3,
        3,
        3,
        3,
        4,
        4,
        4,
        4,
        5,
        5,
        5,
        5,
        5,
        5,
        4,
        4,
        4,
        4,
        4,
        3
      ],
      [
        3,
        3,
        3,
        3,
        3,
        3,
        3,
        3,
        4,
        4,
        4,
        4,
        5,
        5,
        5,
        5,
        5,
        5,
        4,
        4,
        4,
        4,
        4,
        3
      ],
      [
        1,
        1,
        1,
        1,
        1,
        1,
        1,
        1,
        2,
        2,
        2,
        2,
        2,
        2,
        2,
        2,
        2,
        2,
        2,
        2,
        2,
        1,
        1,
        1
      ],
      [
        1,
        1,
        1,
        1,
        1,
        1,
        1,
        1,
        2,
        2,
        2,
        2,
        2,
        2,
        2,
        2,
        2,
        2,
        2,
        2,
        2,
        1,
        1,
        1
      ],
      [
        1,
        1,
        1,
        1,
        1,
        1,
        1,
        1,
        2,
        2,
        2,
        2,
        2,
        2,
        2,
        2,
        2,
        2,
        2,
        2,
        2,
        1,
        1,
        1
      ]
    ],
    "weekend": [
      [
        1,
        1,
        1,
        1,
        1,
        1,
        1,
        1,
        1,
        1,
        1,
        1,
        1,
        1,
        1,
        1,
        1,
        1,
        1,
        1,
        1,
        1,
        1,
        1
      ],
      [
        1,
        1,
        1,
        1,
        1,
        1,
        1,
        1,
        1,
        1,
        1,
        1,
        1,
        1,
        1,
        1,
        1,
        1,
        1,
        1,
        1,
        1,
        1,
        1
      ],
      [
        1,
        1,
        1,
        1,
        1,
        1,
        1,
        1,
        1,
        1,
        1,
        1,
        1,
        1,
        1,
        1,
        1,
        1,
        1,
        1,
        1,
        1,
        1,
        1
      ],
      [
        1,
        1,
        1,
        1,
        1,
        1,
        1,
        1,
        1,
        1,
        1,
        1,
        1,
        1,
        1,
        1,
        1,
        1,
        1,
        1,
        1,
        1,
        1,
        1
      ],
      [
        1,
        1,
        1,
        1,
        1,
        1,
        1,
        1,
        1,
        1,
        1,
        1,
        1,
        1,
        1,
        1,
        1,
        1,
        1,
        1,
        1,
        1,
        1,
        1
      ],
      [
        3,
        3,
        3,
        3,
        3,
        3,
        3,
        3,
        3,
        3,
        3,
        3,
        3,
        3,
        3,
        3,
        3,
        3,
        3,
        3,
        3,
        3,
        3,
        3
      ],
      [
        3,
        3,
        3,
        3,
        3,
        3,
        3,
        3,
        3,
        3,
        3,
        3,
        3,
        3,
        3,
        3,
        3,
        3,
        3,
        3,
        3,
        3,
        3,
        3
      ],
      [
        3,
        3,
        3,
        3,
        3,
        3,
        3,
        3,
        3,
        3,
        3,
        3,
        3,
        3,
        3,
        3,
        3,
        3,
        3,
        3,
        3,
        3,
        3,
        3
      ],
      [
        3,
        3,
        3,
        3,
        3,
        3,
        3,
        3,
        3,
        3,
        3,
        3,
        3,
        3,
        3,
        3,
        3,
        3,
        3,
        3,
        3,
        3,
        3,
        3
      ],
      [
        1,
        1,
        1,
        1,
        1,
        1,
        1,
        1,
        1,
        1,
        1,
        1,
        1,
        1,
        1,
        1,
        1,
        1,
        1,
        1,
        1,
        1,
        1,
        1
      ],
      [
        1,
        1,
        1,
        1,
        1,
        1,
        1,
        1,
        1,
        1,
        1,
        1,
        1,
        1,
        1,
        1,
        1,
        1,
        1,
        1,
        1,
        1,
        1,
        1
      ],
      [
        1,
        1,
        1,
        1,
        1,
        1,
        1,
        1,
        1,
        1,
        1,
        1,
        1,
        1,
        1,
        1,
        1,
        1,
        1,
        1,
        1,
        1,
        1,
        1
      ]
    ]
  }
}