{
  "archetype_id": "energy_1p_02",
  "category": "energy_1period",
  "cluster_id": 2,
  "cluster_share": 0.066,
  "description": "Declining-tier design emphasizing marginal cost reduction and broad affordability; prevalent in Midwest and Great Plains service territories.",
  "representative_plan": {
    "name": "Town of Coatesville, Indiana, Power",
    "state": "IN",
    "eia_id": 3815
  },
  "period_map": {
    "weekday": null,
    "weekend": null
  },
  "periods": [
    {
      "period_index": 0,
      "label": "all-hours",
      "tiers": [
        {
          "rate": 0.1038,
          "max": 300,
          "adj": 0.007164
        },
        {
          "rate": 0.0806,
          "max": 1000,
          "adj": 0.007164
        },
        {
          "rate": 0.0681,
          "max": 2500,
          "adj": 0.007164
        },
        {
          "rate": 0.053,
          "max": null,
          "adj": 0.007164
        }
      ]
    }
  ],
  "unit": "$/kWh",
  "key_states": {
    "by_count": [
      "NE",
      "NC",
      "IN"
    ],
    "by_share": [
      "NE",
      "SD",
      "MO"
    ]
  }
}