{
  "archetype_id": "energy_1p_05",
  "category": "energy_1period",
  "cluster_id": 5,
  "cluster_share": 0.124,
  "description": "Moderate-cost declining-block form providing mild conservation signals while maintaining simple tariff design; typical of cooperative and agricultural rate classes.",
  "representative_plan": {
    "name": "South Plains Electric Coop Inc, Cotton Gins - Net Metering",
    "state": "TX",
    "eia_id": 17561
  },
  "period_map": {
    "weekday": null,
    "weekend": null
  },
  "periods": [
    {
      "period_index": 0,
      "label": "all-hours",
      "tiers": [
        {
          "rate": 0.058138,
          "max": null,
          "adj": 0.0
        }
      ]
    }
  ],
  "unit": "$/kWh",
  "key_states": {
    "by_count": [
      "NC",
      "IN",
      "OH"
    ],
    "by_share": [
      "PA",
      "ND",
      "NC"
    ]
  }
}