{
  "archetype_id": "energy_1p_06",
  "category": "energy_1period",
  "cluster_id": 6,
  "cluster_share": 0.011,
  "description": "Irregular multi-tier configuration exhibiting non-monotonic price variation, indicating specialized or legacy tariff logic maintained by a few utilities.",
  "representative_plan": {
    "name": "Town of High Point, North Carolina, General Service (Rate 10)",
    "state": "NC",
    "eia_id": 8571
  },
  "period_map": {
    "weekday": null,
    "weekend": null
  },
  "periods": [
    {
      "period_index": 0,
      "label": "all-hours",
      "tiers": [
        {
          "rate": 0.155648,
          "max": 3000,
          "adj": 0.0
        },
        {
          "rate": 0.078115,
          "max": 90000,
          "adj": 0.0
        },
        {
          "rate": 0.061944,
          "max": 125,
          "adj": 0.0,
          "max_unit": "kWh/kW"
        },
        {
          "rate": 0.107497,
          "max": 96000,
          "adj": 0.0
        },
        {
          "rate": 0.079609,
          "max": 191000,
          "adj": 0.0
        },
        {
          "rate": 0.077005,
          "max": 400,
          "adj": 0.0,
          "max_unit": "kWh/kW"
        },
        {
          "rate": 0.071242,
          "max": null,
          "adj": 0.0,
          "max_unit": "kWh/kW"
        }
      ]
    }
  ],
  "unit": "$/kWh",
  "key_states": {
    "by_count": [
      "GA",
      "KS",
      "UT"
    ],
    "by_share": [
      "GA",
      "MT",
      "KS"
    ]
  }
}