{
  "archetype_id": "energy_3p_05",
  "category": "energy_3period",
  "cluster_id": 5,
  "cluster_share": 0.099,
  "description": "High-cost flat TOU archetype with steady upward progression across periods; straightforward design emphasizing time-based pricing transparency.",
  "representative_plan": {
    "name": "Town of Groton, Massachusetts, Time-of-Use Commercial-TC",
    "state": "MA",
    "eia_id": 7715
  },
  "periods": [
    {
      "period_index": 1,
      "label": "off-peak",
      "tiers": [
        {
          "rate": 0.1328,
          "max": null,
          "adj": 0.0
        }
      ]
    },
    {
      "period_index": 2,
      "label": "mid-peak",
      "tiers": [
        {
          "rate": 0.1553,
          "max": null,
          "adj": 0.0
        }
      ]
    },
    {
      "period_index": 3,
      "label": "on-peak",
      "tiers": [
        {
          "rate": 0.1776,
          "max": null,
          "adj": 0.0
        }
      ]
    }
  ],
  "unit": "$/kWh",
  "key_states": {
    "by_count": [
      "NY",
      "FL",
      "MN"
    ],
    "by_share": [
      "ME",
      "NY",
      "MN"
    ]
  },
  "period_map": {
    "weekday": [
      [
        1,
        1,
        1,
        1,
        1,
        1,
        1,
        2,
        2,
        2,
        2,
        3,
        3,
        3,
        3,
        3,
        3,
        3,
        3,
        2,
        2,
        2,
        2,
        1
      ],
      [
        1,
        1,
        1,
        1,
        1,
        1,
        1,
        2,
        2,
        2,
        2,
        3,
        3,
        3,
        3,
        3,
        3,
        3,
        3,
        2,
        2,
        2,
        2,
        1
      ],
      [
        1,
        1,
        1,
        1,
        1,
        1,
        1,
        2,
        2,
        2,
        2,
        3,
        3,
        3,
        3,
        3,
        3,
        3,
        3,
        2,
        2,
        2,
        2,
        1
      ],
      [
        1,
        1,
        1,
        1,
        1,
        1,
        1,
        2,
        2,
        2,
        2,
        3,
        3,
        3,
        3,
        3,
        3,
        3,
        3,
        2,
        2,
        2,
        2,
        1
      ],
      [
        1,
        1,
        1,
        1,
        1,
        1,
        1,
        2,
        2,
        2,
        2,
        3,
        3,
        3,
        3,
        3,
        3,
        3,
        3,
        2,
        2,
        2,
        2,
        1
      ],
      [
        1,
        1,
        1,
        1,
        1,
        1,
        1,
        2,
        2,
        2,
        2,
        3,
        3,
        3,
        3,
        3,
        3,
        3,
        3,
        2,
        2,
        2,
        2,
        1
      ],
      [
        1,
        1,
        1,
        1,
        1,
        1,
        1,
        2,
        2,
        2,
        2,
        3,
        3,
        3,
        3,
        3,
        3,
        3,
        3,
        2,
        2,
        2,
        2,
        1
      ],
      [
        1,
        1,
        1,
        1,
        1,
        1,
        1,
        2,
        2,
        2,
        2,
        3,
        3,
        3,
        3,
        3,
        3,
        3,
        3,
        2,
        2,
        2,
        2,
        1
      ],
      [
        1,
        1,
        1,
        1,
        1,
        1,
        1,
        2,
        2,
        2,
        2,
        3,
        3,
        3,
        3,
        3,
        3,
        3,
        3,
        2,
        2,
        2,
        2,
        1
      ],
      [
        1,
        1,
        1,
        1,
        1,
        1,
        1,
        2,
        2,
        2,
        2,
        3,
        3,
        3,
        3,
        3,
        3,
        3,
        3,
        2,
        2,
        2,
        2,
        1
      ],
      [
        1,
        1,
        1,
        1,
        1,
        1,
        1,
        2,
        2,
        2,
        2,
        3,
        3,
        3,
        3,
        3,
        3,
        3,
        3,
        2,
        2,
        2,
        2,
        1
      ],
      [
        1,
        1,
        1,
        1,
        1,
        1,
        1,
        2,
        2,
        2,
        2,
        3,
        3,
        3,
        3,
        3,
        3,
        3,
        3,
        2,
        2,
        2,
        2,
        1
      ]
    ],
    "weekend": [
      [
        1,
        1,
        1,
        1,
        1,
        1,
        1,
        2,
        2,
        2,
        2,
        3,
        3,
        3,
        3,
        3,
        3,
        3,
        3,
        2,
        2,
        2,
        2,
        1
      ],
      [
        1,
        1,
        1,
        1,
        1,
        1,
        1,
        2,
        2,
        2,
        2,
        3,
        3,
        3,
        3,
        3,
        3,
        3,
        3,
        2,
        2,
        2,
        2,
        1
      ],
      [
        1,
        1,
        1,
        1,
        1,
        1,
        1,
        2,
        2,
        2,
        2,
        3,
        3,
        3,
        3,
        3,
        3,
        3,
        3,
        2,
        2,
        2,
        2,
        1
      ],
      [
        1,
        1,
        1,
        1,
        1,
        1,
        1,
        2,
        2,
        2,
        2,
        3,
        3,
        3,
        3,
        3,
        3,
        3,
        3,
        2,
        2,
        2,
        2,
        1
      ],
      [
        1,
        1,
        1,
        1,
        1,
        1,
        1,
        2,
        2,
        2,
        2,
        3,
        3,
        3,
        3,
        3,
        3,
        3,
        3,
        2,
        2,
        2,
        2,
        1
      ],
      [
        1,
        1,
        1,
        1,
        1,
        1,
        1,
        2,
        2,
        2,
        2,
        3,
        3,
        3,
        3,
        3,
        3,
        3,
        3,
        2,
        2,
        2,
        2,
        1
      ],
      [
        1,
        1,
        1,
        1,
        1,
        1,
        1,
        2,
        2,
        2,
        2,
        3,
        3,
        3,
        3,
        3,
        3,
        3,
        3,
        2,
        2,
        2,
        2,
        1
      ],
      [
        1,
        1,
        1,
        1,
        1,
        1,
        1,
        2,
        2,
        2,
        2,
        3,
        3,
        3,
        3,
        3,
        3,
        3,
        3,
        2,
        2,
        2,
        2,
        1
      ],
      [
        1,
        1,
        1,
        1,
        1,
        1,
        1,
        2,
        2,
        2,
        2,
        3,
        3,
        3,
        3,
        3,
        3,
        3,
        3,
        2,
        2,
        2,
        2,
        1
      ],
      [
        1,
        1,
        1,
        1,
        1,
        1,
        1,
        2,
        2,
        2,
        2,
        3,
        3,
        3,
        3,
        3,
        3,
        3,
        3,
        2,
        2,
        2,
        2,
        1
      ],
      [
        1,
        1,
        1,
        1,
        1,
        1,
        1,
        2,
        2,
        2,
        2,
        3,
        3,
        3,
        3,
        3,
        3,
        3,
        3,
        2,
        2,
        2,
        2,
        1
      ],
      [
        1,
        1,
        1,
        1,
        1,
        1,
        1,
        2,
        2,
        2,
        2,
        3,
        3,
        3,
        3,
        3,
        3,
        3,
        3,
        2,
        2,
        2,
        2,
        1
      ]
    ]
  }
}